{"$schema":"https://json-schema.org/draft/2020-12/schema","title":"DB++ Exercise Identity Crosswalk","type":"object","required":["target","mappingVersion","status","targetSpecification","entries"],"properties":{"target":{"type":"string"},"mappingVersion":{"type":"string"},"status":{"enum":["draft-reviewed","stable","placeholder"]},"targetSpecification":{"type":"object","required":["name","version","reviewedOn","references"],"properties":{"name":{"type":"string"},"version":{"type":"string"},"reviewedOn":{"type":"string","format":"date"},"references":{"type":"array","minItems":1,"items":{"type":"string","format":"uri"}}}},"entries":{"type":"array","items":{"type":"object","required":["externalId","externalName","dbppExerciseIds","relation","direction","confidence","provenance"],"properties":{"externalId":{"type":"string"},"externalName":{"type":"string"},"dbppExerciseIds":{"type":"array","items":{"type":"string"}},"relation":{"enum":["exact","close","broader","narrower","approximate","unmapped"]},"direction":{"enum":["external_to_dbpp","dbpp_to_external","bidirectional"]},"confidence":{"enum":["high","medium","low"]},"provenance":{"type":"object","required":["source","rationale"],"properties":{"source":{"type":"string","format":"uri"},"rationale":{"type":"string"}}}}}}}}
